first_name,last_name,email,personal_email,mobile_number,full_name,job_title,linkedin,company_name,company_website,industry,company_size,headline,seniority_level,functional_level,city,state,country,company_linkedin,company_linkedin_uid,company_founded_year,company_domain,company_phone,company_street_address,company_full_address,company_state,company_city,company_country,company_postal_code,keywords,company_description,company_annual_revenue,company_annual_revenue_clean,company_total_funding,company_total_funding_clean,company_technologies,title,organization_name,organization_website_url,organization_short_description
Kimberly,Allain,kgallain@cpp.edu,,19515413470.0,Kimberly Allain,"Sr. Avp, Chief Human Resources Officer ",http://www.linkedin.com/in/kimberly-allain-6612672,California State Polytechnic University-pomona,http://www.cpp.edu,higher_education,1100,CHRO | Talent Strategy | Employee Experience | People And Culture | Organizational Development,c_suite,c_suite,Corona,California,United States,http://www.linkedin.com/school/cal-poly-pomona,10265,1938.0,cpp.edu,+1 909-869-4549,3801 W Temple Ave,"3801 West Temple Avenue, Pomona, CA 91768, US",California,Pomona,United States,91768,"we cultivate success through a diverse culture of experiential learning, discovery & innovation, student success, academic programs, financial aid, campus events, career services, media relations, diversity, inclusivity, university rankings, social mobility, student engagement, research opportunities, support services, housing options, scholarship programs, community involvement, cal poly pomona, bronco athletics, cultural events, educational partnerships, outreach programs, online privacy, digital marketing, student admissions, alumni relations, academic support, internship placements, faculty expertise, work-study programs, student organizations, institutional research, campus life, branding, strategic communications, marketing strategies, technology support, faculty development, educational resources, counseling services, service requests, personal information management, financial management, event registration, crisis communication, executive communications, narrative storytelling, social media engagement, student involvement opportunities, job placements, public polytechnic university, hands-on learning, diverse student body, engineering programs, business administration, hospitality management, sustainable agriculture, applied sciences, student support services, community engagement, cultural diversity, first-generation students, hispanic-serving institution, career-focused education, innovative research, environmental design, internships, service-learning, economic mobility, california state university system, urban planning, technology management, mentoring programs, low-income support, international students, student affairs, academic excellence, inclusive education, real-world experience, collaborative learning, student services, transportation services, campus facilities, sustainability initiatives, public relations & communications, marketing & advertising, marketing strategy",Cal Poly Pomona offers advance learning and knowledge by linking theory and practice in all disciplines and to prepare students for lifelong learning.,540000.0,540K,1000000.0,1M,"asp.net, amazon aws, apache, bootstrap framework, formstack, google tag manager, inmotion hosting dns, microsoft-iis, mobile friendly, openssl, outlook, react redux, route 53, servicenow, signalr, statcounter, typekit, umbraco, youtube","Sr. Avp, Chief Human Resources Officer ",Cal Poly Pomona,http://www.cpp.edu,Cal Poly Pomona offers advance learning and knowledge by linking theory and practice in all disciplines and to prepare students for lifelong learning.
Warren,Ricks,warren@smu.edu,,,Warren Ricks,Associate Vice President And Chief Risk Officer,http://www.linkedin.com/in/warren-ricks-3385403,Smu,http://www.smu.edu,higher_education,39,,c_suite,finance,Dallas,Texas,United States,http://www.linkedin.com/school/smudallas,5515,1911.0,smu.edu,+1 404-679-4500,6425 Boaz Ln,"6425 Boaz Lane, Dallas, Texas, USA, 75275",Texas,Dallas,United States,75205,"higher education, executive mba, continuing education, ceus, academic programs, graduate education, undergraduate admissions, research initiatives, financial assistance, scholarships, hands-on experience, study abroad, professional development, community engagement, interdisciplinary research, data science, high-performance computing, educational goals, student life, leadership development, career opportunities, international studies, arts & humanities, engineering programs, business education, law school, theology, public service, cultural engagement, alumni relations, impactful learning, entrepreneurial ecosystem, student resources, innovative teaching, experiential learning, campus facilities, education partnerships, scholarly research, student organizations, health & wellbeing, diversity & inclusion, community outreach, sports programs, academic excellence, global impact, technology transfer, knowledge creation, collaborative research, academic freedom, student support services, virtual learning, educational pathways, education management","A nationally ranked private university with seven degree-granting schools, SMU is a distinguished center for teaching and research located in the heart of Dallas. SMU's 11,000 students benefit from small classes, leadership opportunities, international study and innovative programs.",945000000.0,945M,,,"ab tasty, asp.net, active campaign, adobe media optimizer, amadesa, amazon aws, amazon ses, appnexus, atlassian cloud, atlassian confluence, bing ads, blackbaud, bootstrap framework, callrail, cedexis radar, constant contact, crazyegg, criteo, datadog, disqus, docusign, doubleclick, doubleclick conversion, doubleclick floodlight, drupal, dynect, emma, ensighten, facebook custom audiences, facebook login (connect), facebook widget, github hosting, google adsense, google adwords conversion, google analytics, google analytics ecommerce tracking, google custom search, google dynamic remarketing, google font api, google maps, google maps (non paid users), google play, google tag manager, google translate api, google translate widget, heapanalytics, highcharts js library, hotjar, hubspot, ibm websphere, indeed, intercom, jira, kaltura, linkedin login, linkedin marketing solutions, linkedin widget, livechat, marketo, microsoft-iis, mobile friendly, mouseflow, multilingual, onetrust, optimizely, outlook, panopto, pardot, pingdom, react redux, remote, ruby on rails, salesforce, salesforce live agent, segment.io, sharethis, signal by brighttag, signalr, sitescout, sizmek (mediamind), sparkpost, stripe, synxis (sabre hospitality), taleo, the trade desk, trustpilot, twitter advertising, typekit, userlike, vimeo, visual website optimizer, wistia, wordpress.org, wordpress vip, yahoo ad manager plus, yahoo analytics, youtube, itunes, recaptcha",Associate Vice President And Chief Risk Officer,Smu,http://www.smu.edu,"A nationally ranked private university with seven degree-granting schools, SMU is a distinguished center for teaching and research located in the heart of Dallas. SMU's 11,000 students benefit from small classes, leadership opportunities, international study and innovative programs."
Sohye,Park,sohye.park@ruffalonl.com,,,Sohye Park,Avp - Applied Ai • Product Owner ,http://www.linkedin.com/in/sohye-park-606b8a118,Ruffalo Noel Levitz,http://www.ruffalonl.com,higher_education,1100,Ai Product Management | Applied Ai | Data Science | Phd Candidate In Applied Linguistics,owner,product_management,Philadelphia,Pennsylvania,United States,http://www.linkedin.com/company/ruffalonoellevitz,19499,1991.0,ruffalonl.com,+1 319-626-8383,1025 Kirkwood Parkway Southwest,"1025 Kirkwood Parkway SW, Cedar Rapids, IA 52404, US",Iowa,Cedar Rapids,United States,52404,"enrollment management, fundraising management, student success, retention, planned giving, marketing, financial aid services, software, engagement, telefundraising, remote engagement, higher education, graduate & online enrollment, online program management, online program enablement, adult student lifecycle, nonprofits, ventures for good, social fundraising, non profit, social media, consumer internet, internet, information technology, fundraising solutions, crm solutions, student retention, digital fundraising, financial aid solutions, graduate enrollment, undergraduate recruitment, market research, strategic enrollment planning, lead generation, retention management system, donor engagement, major gift fundraising, personalization, ai solutions, academic analytics, omnichannel engagement, data integration, campus research, yield optimization, career services, client engagement, financial aid management, enrollment consulting, satisfaction surveys, college completion rates, philanthropy, annual giving, digital giving, research consulting, competitor analysis, marketing strategies, alumni engagement, enrollment toolkit, customized communication, in-depth assessment, performance metrics, retention strategies, student outreach, higher education consulting, fundraising consulting, student engagement, ai governance, digital marketing, student lifecycle management, campaign management, strategic partnerships, community engagement, nonprofit sector, ai technology, predictive analytics, student recruitment, multichannel engagement, advanced analytics, personalized marketing, educational consulting, engagement software, crowdfunding, giving day, institutional partnerships, demographic challenges, flexible work environment, skill development, customer engagement, strategic planning, online training, 24/7 support, collaborative culture, innovative solutions, digital advertising, student demographics, educational technology, information technology & services, education management, nonprofit organization management, consumers, fund-raising, marketing & advertising, sales, enterprise software, enterprises, computer software, b2b, marketing strategy","RNL is the leading provider of higher education enrollment management, student success, and fundraising solutions.

For more than 40 years, colleges and nonprofit organizations have turned to Ruffalo Noel Levitz to enroll the students they want, help more students graduate and succeed, and build lifelong relationships with donors. Our mission is to make colleges, universities, and nonprofits successful and vibrant with inspired and relevant engagement.",40000000.0,40M,,,"asp.net, asp.net, adroll, adroll, adobe media optimizer, adobe media optimizer, amazon aws, amazon aws, amazon cloudfront, amazon cloudfront, amazon elastic load balancer, amazon elastic load balancer, amazon ses, amazon ses, amplitude, amplitude, appnexus, appnexus, atlassian cloud, atlassian cloud, barracuda msp, barracuda msp, basis, basis, bing ads, bing ads, bootstrap framework, bootstrap framework, bootstrap framework v3.2.0, bootstrap framework v3.2.0, cedexis radar, cedexis radar, cloudinary, cloudinary, crazyegg, crazyegg, cvent, cvent, data analytics, data analytics, doubleclick, doubleclick, doubleclick conversion, doubleclick conversion, doubleclick floodlight, doubleclick floodlight, drift, drift, facebook custom audiences, facebook custom audiences, facebook login (connect), facebook login (connect), facebook widget, facebook widget, gmail, gmail, google analytics, google analytics, google analytics ecommerce tracking, google analytics ecommerce tracking, google apps, google apps, google dynamic remarketing, google dynamic remarketing, google font api, google font api, google tag manager, google tag manager, gravity forms, gravity forms, hotjar, hotjar, linkedin marketing solutions, linkedin marketing solutions, liveramp, liveramp, mailchimp mandrill, mailchimp mandrill, marketo, marketo, micro, micro, microsoft office 365, microsoft office 365, microsoft-iis, microsoft-iis, mixpanel, mixpanel, mobile friendly, mobile friendly, new relic, new relic, nginx, nginx, outlook, outlook, pantheon, pantheon, remote, remote, reviews, reviews, route 53, route 53, salesforce, salesforce, sendgrid, sendgrid, shutterstock, shutterstock, sitescout, sitescout, the trade desk, the trade desk, varnish, varnish, vidyard, vidyard, vimeo, vimeo, vuejs, vuejs, wp engine, wp engine, wistia, wistia, wordpress.org, wordpress.org, xamarin, xamarin, youtube, youtube, zendesk, zendesk, recaptcha, recaptcha",Owner,RNL,http://www.ruffalonl.com,"RNL is the leading provider of higher education enrollment management, student success, and fundraising solutions.

For more than 40 years, colleges and nonprofit organizations have turned to Ruffalo Noel Levitz to enroll the students they want, help more students graduate and succeed, and build lifelong relationships with donors. Our mission is to make colleges, universities, and nonprofits successful and vibrant with inspired and relevant engagement."
Leigh,Moffett,leighannm@mail.smu.edu,,,Leigh Moffett,Associate Vice President And Chief Risk Officer,http://www.linkedin.com/in/leigh-ann-moffett,Smu,http://www.smu.edu,higher_education,39,Associate Vice President And Chief Risk Officer At Southern Methodist University,c_suite,finance,Dallas,Texas,United States,http://www.linkedin.com/school/smudallas,5515,1911.0,smu.edu,+1 404-679-4500,6425 Boaz Ln,"6425 Boaz Lane, Dallas, Texas, USA, 75275",Texas,Dallas,United States,75205,"higher education, executive mba, continuing education, ceus, academic programs, graduate education, undergraduate admissions, research initiatives, financial assistance, scholarships, hands-on experience, study abroad, professional development, community engagement, interdisciplinary research, data science, high-performance computing, educational goals, student life, leadership development, career opportunities, international studies, arts & humanities, engineering programs, business education, law school, theology, public service, cultural engagement, alumni relations, impactful learning, entrepreneurial ecosystem, student resources, innovative teaching, experiential learning, campus facilities, education partnerships, scholarly research, student organizations, health & wellbeing, diversity & inclusion, community outreach, sports programs, academic excellence, global impact, technology transfer, knowledge creation, collaborative research, academic freedom, student support services, virtual learning, educational pathways, education management","A nationally ranked private university with seven degree-granting schools, SMU is a distinguished center for teaching and research located in the heart of Dallas. SMU's 11,000 students benefit from small classes, leadership opportunities, international study and innovative programs.",945000000.0,945M,,,"ab tasty, asp.net, active campaign, adobe media optimizer, amadesa, amazon aws, amazon ses, appnexus, atlassian cloud, atlassian confluence, bing ads, blackbaud, bootstrap framework, callrail, cedexis radar, constant contact, crazyegg, criteo, datadog, disqus, docusign, doubleclick, doubleclick conversion, doubleclick floodlight, drupal, dynect, emma, ensighten, facebook custom audiences, facebook login (connect), facebook widget, github hosting, google adsense, google adwords conversion, google analytics, google analytics ecommerce tracking, google custom search, google dynamic remarketing, google font api, google maps, google maps (non paid users), google play, google tag manager, google translate api, google translate widget, heapanalytics, highcharts js library, hotjar, hubspot, ibm websphere, indeed, intercom, jira, kaltura, linkedin login, linkedin marketing solutions, linkedin widget, livechat, marketo, microsoft-iis, mobile friendly, mouseflow, multilingual, onetrust, optimizely, outlook, panopto, pardot, pingdom, react redux, remote, ruby on rails, salesforce, salesforce live agent, segment.io, sharethis, signal by brighttag, signalr, sitescout, sizmek (mediamind), sparkpost, stripe, synxis (sabre hospitality), taleo, the trade desk, trustpilot, twitter advertising, typekit, userlike, vimeo, visual website optimizer, wistia, wordpress.org, wordpress vip, yahoo ad manager plus, yahoo analytics, youtube, itunes, recaptcha",Associate Vice President And Chief Risk Officer,Smu,http://www.smu.edu,"A nationally ranked private university with seven degree-granting schools, SMU is a distinguished center for teaching and research located in the heart of Dallas. SMU's 11,000 students benefit from small classes, leadership opportunities, international study and innovative programs."
Bart,Klein,bart.klein@rockhurst.edu,,18165202800.0,Bart Klein,Associate Vice President Of Information Technology (CIO),http://www.linkedin.com/in/bartjklein,Rockhurst University,http://www.rockhurst.edu,higher_education,920,Associate Vice President Of Information Technology At Rockhurst University (CIO),c_suite,c_suite,Kansas City,Missouri,United States,http://www.linkedin.com/school/rockhurst-university,19931,1910.0,rockhurst.edu,+1 816-501-4000,1100 Rockhurst Rd,"1100 Rockhurst Rd, Kansas City, mo 64110-2561, US",Missouri,Kansas City,United States,64110,"higher education & helzberg school of management, rockhurst university, kansas city, education, college programs, jesuit values, admissions, undergraduate programs, graduate programs, financial aid, tuition, student services, academic advising, liberal arts, business administration, nursing, engineering, computer science, cybersecurity, health science, criminal justice, psychology, marketing, international business, pre-med, pre-law, stem, art & design, performance arts, leadership development, sports management, environmental studies, statistics, humanities, communication, medical laboratory science, biotechnology, pre-occupational therapy, pre-physical therapy, pre-physician assistant, pre-dentistry, public policy, educational studies, graduate certificates, data analytics, social justice, community outreach, alumni network, career services, class sizes, interdisciplinary studies, private jesuit institution, liberal arts education, community service, healthcare education, stem programs, student support services, personalized education, small class sizes, faculty engagement, diverse student body, ethical decision-making, lifelong learning, ncaa division ii athletics, campus facilities, student life, alumni benefits, community engagement, transformative education, inclusive environment, academic excellence, career development, cultural events, service-learning initiatives, student accessibility services, health sciences, technology programs, scholarships, student organizations, experiential learning, global engagement, local partnerships, economic development","Rockhurst is a Catholic, Jesuit university serving 3,000 students in the business and cultural heart of Kansas City. It is a comprehensive university that offers more than 50 undergraduate and graduate programs taught by nationally recognized faculty.",3194000.0,3.2M,,,"ab tasty, appnexus, bing ads, doubleclick, doubleclick conversion, doubleclick floodlight, drupal, facebook custom audiences, facebook login (connect), facebook widget, google analytics, google dynamic remarketing, google tag manager, hotjar, linkedin marketing solutions, livechat, microsoft office 365, mobile friendly, new relic, nginx, outlook, paypal, route 53, stripe, typekit, varnish, visual website optimizer, youtube",Associate Vice President Of Information Technology (CIO),Rockhurst University,http://www.rockhurst.edu,"Rockhurst is a Catholic, Jesuit university serving 3,000 students in the business and cultural heart of Kansas City. It is a comprehensive university that offers more than 50 undergraduate and graduate programs taught by nationally recognized faculty."
Matthew,Cooper,mcooper@tesu.edu,,16093416468.0,Matthew Cooper,Associate Vice President Of Organizational Learning & Chief Technology Officer,http://www.linkedin.com/in/matthew-cooper-85639513,Thomas Edison State University,http://www.tesu.edu,higher_education,720,Associate Vice President Of Organizational Learning & Chief Technology Officer,c_suite,c_suite,,Pennsylvania,United States,http://www.linkedin.com/school/thomas-edison-state-university,15102143,1972.0,tesu.edu,+1 609-777-5680,111 W State St,"111 W State St, Trenton, New Jersey 08608, US",New Jersey,Trenton,United States,08608,"adult education, online degree programs, flexible learning, accreditation, credit transfers, tuition assistance, military-friendly, prior learning assessment, career advancement, accommodations for students, scholarships, financial aid, academic advising, course registration, non-traditional learners, undergraduate programs, graduate programs, veteran resources, certificate programs, business degrees, nursing programs, information technology, cybersecurity degrees, student accessibility, study at your own pace, distance learning, public service programs, self-directed learning, affordable education, credit for experience, time management, career-focused education, learning opportunities, student success resources, admissions support, online coursework, academic flexibility, educational integrity, degree completion programs, lifelong learning, student engagement, networking opportunities, working adults, curriculum design, student-centric approach, global learning, innovative education, tesu alumni support, community involvement, personalized education, online courses, degree programs, associate degrees, bachelor's degrees, master's degrees, doctoral degrees, credit transfer, student support services, workforce development, healthcare education, business management, cybersecurity, public service, innovation in education, accessibility, diverse student body, career-relevant programming, strategic partnerships, empowering lives, b2b","Study with the leader in online education. 

Thomas Edison State University has a national reputation for academic excellence and educational integrity. The University is one of New Jersey's 11 senior public institutions of higher education and one of the first schools in the country designed specifically for adults. The University provides flexible, high-quality, collegiate learning opportunities for self-directed adults and offers degree programs and certificates in more than 100 areas of study.

Thomas Edison State University's flexible learning methods range from online courses and prior learning assessment to credit transfer and credit-bearing exams. We offer undergraduate and graduate programs tailored to the needs of adults, whether it is for professional advancement or personal fulfillment.",,,,,"adp workforce now, asp.net, adform, amazon ses, blackboard lms, bootstrap framework, dns made easy, doubleclick, doubleclick conversion, doubleclick floodlight, facebook custom audiences, facebook login (connect), facebook widget, flashtalking, google analytics, google dynamic remarketing, google font api, google play, google tag manager, hubspot, kaltura, linkedin marketing solutions, microsoft office 365, microsoft-iis, mobile friendly, multilingual, nginx, outlook, react redux, simpli.fi, the trade desk, triplelift, youtube, zendesk, itunes",Associate Vice President Of Organizational Learning & Chief Technology Officer,Thomas Edison State University,http://www.tesu.edu,"Study with the leader in online education. 

Thomas Edison State University has a national reputation for academic excellence and educational integrity. The University is one of New Jersey's 11 senior public institutions of higher education and one of the first schools in the country designed specifically for adults. The University provides flexible, high-quality, collegiate learning opportunities for self-directed adults and offers degree programs and certificates in more than 100 areas of study.

Thomas Edison State University's flexible learning methods range from online courses and prior learning assessment to credit transfer and credit-bearing exams. We offer undergraduate and graduate programs tailored to the needs of adults, whether it is for professional advancement or personal fulfillment."
