first_name,last_name,email,personal_email,mobile_number,full_name,job_title,linkedin,company_name,company_website,industry,company_size,headline,seniority_level,functional_level,city,state,country,company_linkedin,company_linkedin_uid,company_founded_year,company_domain,company_phone,company_street_address,company_full_address,company_state,company_city,company_country,company_postal_code,keywords,company_description,company_annual_revenue,company_annual_revenue_clean,company_total_funding,company_total_funding_clean,company_technologies,title,organization_name,organization_website_url,organization_short_description
Brian,Phelps,brian@sftots.com,,,Brian Phelps,Owner And General Manager,http://www.linkedin.com/in/brian-phelps-90645aa,Sf Tots,http://www.sftots.com,sports_arenas,12,Owner Of Sf Tots,owner,,San Francisco,California,United States,http://www.linkedin.com/company/sf-tots,3106535,2008.0,sftots.com,+1 415-762-5123,435 23rd Street,"435 23rd St Suite 10, San Francisco, CA 94107, Verenigde Staten",California,San Francisco,United States,94107,"toddlers, youth sports, toddler sports, sports, child development, soccer, basketball, fun, spectator sports, active life, art classes, arts & entertainment, cultural center, dance schools, education, fitness & instruction, kids activities, recreation centers, specialty schools, sports clubs, trainers","We provide soccer and basketball programs for young children. SF Tots Soccer child development classes are for children starting at 18 mos up to 6 years old. SF Tots Hoops classes are for kids starting at 2½ years old up to 6 years old. MiniSoccer scrimmages for kids aged 5 to 6 years old provide an opportunity to play soccer in a small team format to maximize playing time.

 We use creative story-based games to teach children about sports and child development fundamentals. Our emphasis is on fun in a non-competitive atmosphere.

Read more about us and our programs on the website to discover why hundreds of parents bring their children to our programs each month!",,,,,"android, circle, flutter, gmail, google apps, google font api, google maps, iot, mobile friendly, python, remote, sap, sharepoint, squarespace ecommerce, yelp",Owner,SF Tots,http://www.sftots.com,"We provide soccer and basketball programs for young children. SF Tots Soccer child development classes are for children starting at 18 mos up to 6 years old. SF Tots Hoops classes are for kids starting at 2½ years old up to 6 years old. MiniSoccer scrimmages for kids aged 5 to 6 years old provide an opportunity to play soccer in a small team format to maximize playing time.

 We use creative story-based games to teach children about sports and child development fundamentals. Our emphasis is on fun in a non-competitive atmosphere.

Read more about us and our programs on the website to discover why hundreds of parents bring their children to our programs each month!"
Benji,Cooksey,benji@cszhouston.com,,,Benji Cooksey,Owner | General Manager,http://www.linkedin.com/in/benji-cooksey-840067179,Comedysportz Houston,http://www.comedysportzhouston.com,sports_arenas,20,Owner | General Manager,owner,,Houston,Texas,United States,http://www.linkedin.com/company/comedysportz-houston,740895,1990.0,comedysportzhouston.com,+1 713-868-1444,2201 Preston St,"2201 Preston St, Houston, Texas 77003, US",Texas,Houston,United States,77003-2222,"team building, entertainment, live talent, customized private events, corporate entertainment, comedy, public speaking, improv, entertainment providers, comedy clubs, nightlife","CSz HOUSTON is the Gulf coast's #1 professional improv comedy company.  For over three decades, CSz Houston has been the home of ComedySportz.  ComedySportz, performed every week for public audiences and private events is NOT about sports; it IS comedy played with a competitive edge.

CSz HOUSTON also produces ""The Great Game Show Mash Up"", the late-night adults only ""Unscripted"" series (A Christmas Carol UNSCRIPTED, Star Wars UNSCRIPTED, Aladdin UNSCRIPTED, Etc.)

ComedySportz performs every week at the ComedySportz Arena, located in downtown Houston. Bring your group to our 120-seat, air-conditioned theatre.

CSz HOUSTON shows and Workshops are available 24/7/365 for corporate and private events -- anywhere in Texas or across the U.S..  Our talented team also provides team building and talent for promotional marketing projects.",11398000.0,11.4M,,,"android, facebook custom audiences, facebook login (connect), facebook widget, flutter, gmail, google apps, google font api, google tag manager, iot, mailchimp mandrill, mobile friendly, proofpoint, python, remote, sharepoint, vimeo, youtube",Owner,CSz Houston,http://www.comedysportzhouston.com,"CSz HOUSTON is the Gulf coast's #1 professional improv comedy company.  For over three decades, CSz Houston has been the home of ComedySportz.  ComedySportz, performed every week for public audiences and private events is NOT about sports; it IS comedy played with a competitive edge.

CSz HOUSTON also produces ""The Great Game Show Mash Up"", the late-night adults only ""Unscripted"" series (A Christmas Carol UNSCRIPTED, Star Wars UNSCRIPTED, Aladdin UNSCRIPTED, Etc.)

ComedySportz performs every week at the ComedySportz Arena, located in downtown Houston. Bring your group to our 120-seat, air-conditioned theatre.

CSz HOUSTON shows and Workshops are available 24/7/365 for corporate and private events -- anywhere in Texas or across the U.S..  Our talented team also provides team building and talent for promotional marketing projects."
Rick,Steadman,rick@portlandcomedy.com,,12132206629.0,Rick Steadman,Owner/gm,http://www.linkedin.com/in/rick-steadman-1a792374,Csz Portland,http://www.portlandcomedy.com,sports_arenas,12,Owner/gm,owner,,Portland,Oregon,United States,http://www.linkedin.com/company/cszportland,3147786,1993.0,portlandcomedy.com,+1 503-236-8888,1963 NW Kearney St,"1963 NW Kearney St., Portland, OR 97209, US",Oregon,Portland,United States,97209,"improvisational comedy, special events, corporate team building, classes in improv, stand up & more, corporate training, applied improv, entertainment providers, professional training & coaching, comedy clubs, nightlife","CSz Portland is a company of creative people who perform, teach and lead with a strong foundation in improvisation and a ""Yes, And..."" attitude.

We work with businesses, government agencies, non-profits, groups, education and enrichment seekers and public audiences of all kinds.

We are connected to the world through CSz Worldwide (cszworldwide.com), with ComedySportz teams in 25 cities (US and Europe) and through the Applied Improvisation Network.

We offer Public and Private/Custom Shows at our Arena, Road Shows, Classes, Professional Development Training, Branded Theatre and other Creative Services. Many of these services are available online as well - we are experts in Zoom-based training.

We are flexible & easy to work with.


We play ComedySportz! About the ComedySportz Show:

ComedySportz -- Portland's longest-running show - is fast-paced, clean, family-friendly and competitive improvisational comedy. We've played every weekend since May 28, 1993.

Two teams alternate improvised scenes, games and songs, and the audience votes for the team they like better. A referee explains the rules, calls the ComedySportz fouls, and solicits suggestions from the audience to inspire every scene/game. The ref is our secret weapon - the ref keeps it moving and keeps it clean.

ComedySportz is 100 percent family and business friendly. It's a show that entertains everyone with offending anyone - our regular show audiences features bachelor parties, church groups, senior citizens, teenagers, kids and adults at the same time.

More info at cszportland.com or visit linktr.ee/CSzPortland for fast links.",10761000.0,10.8M,,,"autodesk, google analytics, google font api, google tag manager, mailchimp mandrill, mobile friendly, remote, reviews, typekit, youtube",Owner,CSz Portland,http://www.portlandcomedy.com,"CSz Portland is a company of creative people who perform, teach and lead with a strong foundation in improvisation and a ""Yes, And..."" attitude.

We work with businesses, government agencies, non-profits, groups, education and enrichment seekers and public audiences of all kinds.

We are connected to the world through CSz Worldwide (cszworldwide.com), with ComedySportz teams in 25 cities (US and Europe) and through the Applied Improvisation Network.

We offer Public and Private/Custom Shows at our Arena, Road Shows, Classes, Professional Development Training, Branded Theatre and other Creative Services. Many of these services are available online as well - we are experts in Zoom-based training.

We are flexible & easy to work with.


We play ComedySportz! About the ComedySportz Show:

ComedySportz -- Portland's longest-running show - is fast-paced, clean, family-friendly and competitive improvisational comedy. We've played every weekend since May 28, 1993.

Two teams alternate improvised scenes, games and songs, and the audience votes for the team they like better. A referee explains the rules, calls the ComedySportz fouls, and solicits suggestions from the audience to inspire every scene/game. The ref is our secret weapon - the ref keeps it moving and keeps it clean.

ComedySportz is 100 percent family and business friendly. It's a show that entertains everyone with offending anyone - our regular show audiences features bachelor parties, church groups, senior citizens, teenagers, kids and adults at the same time.

More info at cszportland.com or visit linktr.ee/CSzPortland for fast links."
Chris,Tretter,ctretter@sultansrun.com,,18126397813.0,Chris Tretter,Co-owner And General Manager,http://www.linkedin.com/in/chris-tretter-a15142224,Sultan's Run,http://www.sultansrun.com,sports_arenas,15,Co-owner And General Manager,owner,,Jasper,Indiana,United States,http://www.linkedin.com/company/sultan's-run-golf-club,15414164,1992.0,sultansrun.com,+1 812-482-1009,1490 N Meridian Rd,"1490 N Meridian Rd, Jasper, Indiana 47546, US",Indiana,Jasper,United States,47546,"golf, banquet center, catering, golf merchandise, golf apparel, golf course, golf club, wedding, event venue, lodging, airbnb, stay & play","Rated #4 Public Golf Course in the USA | Rated #1 Public Golf Course in Indiana | 2023 Senior LPGA Championship Host | Home of the Most Dramatic Signature Hole in Indiana |

World-Class Golf | Luxury Lodging | Premium Service | Exceptional Banquets | Chef-Inspired Catering | Superior Value",3987000.0,4.0M,,,"amazon aws, android, cloudflare dns, flutter, gmail, google analytics, google apps, google tag manager, heapanalytics, iot, lucky orange, mobile friendly, nginx, python, remote, sharepoint, tealium",Owner,Sultan's Run Golf Club,http://www.sultansrun.com,"Rated #4 Public Golf Course in the USA | Rated #1 Public Golf Course in Indiana | 2023 Senior LPGA Championship Host | Home of the Most Dramatic Signature Hole in Indiana |

World-Class Golf | Luxury Lodging | Premium Service | Exceptional Banquets | Chef-Inspired Catering | Superior Value"
Adam,Siegel,adam@lupiandiris.com,,14146986377.0,Adam Siegel,Executive Chef / Owner,http://www.linkedin.com/in/adam-siegel-a41350a,Lupi & Iris,http://www.lupiandiris.com,restaurant_chains,26,Executive Chef / Owner At Lupi & Iris,owner,,Milwaukee,Wisconsin,United States,http://www.linkedin.com/company/lupi-iris,79382013,,lupiandiris.com,+1 414-293-9090,777 N Van Buren St,"777 N Van Buren St, Milwaukee, Wisconsin 53202, US",Wisconsin,Milwaukee,United States,53202,"fine dining, restaurant, french cuisine, italian cuisine, mediterranean menu, wine collection, private dining, event catering, seasonal promotions, gift cards, happy hour, special events, chef collaboration, culinary experience, exclusive dining, dinner reservation, restaurant events, local ingredients, premium wine, meal preparation, dining experience, food artistry, upscale service, dinner menu, prix fixe, brunch, culinary team, private parties, food enthusiasts, catering services, dinner service, sophisticated atmosphere, meetings & events, wine pairing, sustainably sourced, event planning, family dining, wine tastings, live music events, group dining, team building, culinary workshops, fine wine, culinary excellence, chef specials, casual dining, meat preparations, fresh ingredients, artisanal menu, restaurants, events services",,,,,,"mobile friendly, outlook, remote, reviews, squarespace ecommerce, typekit",Owner,Lupi & Iris,http://www.lupiandiris.com,
Jenner,Tomaska,jtomaska@esmechicago.com,,13122414628.0,Jenner Tomaska,Owner & Executive Chef,http://www.linkedin.com/in/jenner-tomaska-021971125,Esmé,http://www.esmechicago.com,restaurant_chains,22,Chef/ Owner,owner,,Chicago,Illinois,United States,http://www.linkedin.com/company/esm%c3%a9,73984153,,esmechicago.com,,2200 N Clark St,"2200 N Clark St, Chicago, Illinois 60614, US",Illinois,Chicago,United States,60614-3855,,,,,,,"7shifts, basis, canva, circle, facebook custom audiences, facebook login (connect), facebook widget, gmail, google analytics, google apps, google font api, google maps, google tag manager, mobile friendly, remote, reviews, sharepoint, squarespace ecommerce, tiktok, typekit",Owner,Esmé,http://www.esmechicago.com,
Jeff,Hetsel,jhetsel@cicispizza.com,,,Jeff Hetsel,President And Chief Operating Officer,http://www.linkedin.com/in/jeff-hetsel-cfe-a983a039,Cicis Pizza,http://www.cicis.com,restaurant_chains,2300,President Cicis Pizza And Jmc Distribution,c_suite,c_suite,Dallas,Texas,United States,http://www.linkedin.com/company/cicispizza,421059,1985.0,cicis.com,+1 951-278-2424,1080 W Bethel Rd,"1080 W Bethel Rd, Coppell, TX 75019, US",Texas,Coppell,United States,75019-4427,"quality, value, service, variety, pizza, buffet, cinnamon rolls, unlimited, game rooms, buffet dining, all-you-can-eat, pasta, salads, desserts, family-friendly, affordable dining, value meals, game zone, franchise opportunities, specialty pizzas, personal pizzas, limited-time offers, delivery, pickup, online ordering, fundraising events, nutritional information, loyalty program, children, youth, middle-class families, quick service, casual dining, competitive pricing, customer engagement, feedback programs, pizza chain, restaurant industry, casual dining sector, customer service, dessert options, budget-friendly meals, dining experience, entertainment options, innovative menu, market positioning, restaurants","In 1985, Joe Croce and Mike Cole opened one To-Go pizza restaurant in Plano, TX. A year later, they established Cicis as the ""Best Pizza Value Anywhere"" by developing the Unlimited Pizza Buffet.

Cicis currently operates over 300 restaurants in more than 30 states.

The newly re-designed and rebranded Cicis concept pushes the limits of the regular restaurant experience by offering a variety of pizza, salad, soups, pasta and desserts including such popular items as stuffed crust and flatbread pizzas. The customer experience also includes a fun game room making the concept very family oriented and kid friendly.",18298000.0,18.3M,,,"barracuda networks, cloudflare cdn, cloudflare hosting, microsoft azure hosting, microsoft office 365, mimecast, outlook, remote",COO,Cicis,http://www.cicis.com,"In 1985, Joe Croce and Mike Cole opened one To-Go pizza restaurant in Plano, TX. A year later, they established Cicis as the ""Best Pizza Value Anywhere"" by developing the Unlimited Pizza Buffet.

Cicis currently operates over 300 restaurants in more than 30 states.

The newly re-designed and rebranded Cicis concept pushes the limits of the regular restaurant experience by offering a variety of pizza, salad, soups, pasta and desserts including such popular items as stuffed crust and flatbread pizzas. The customer experience also includes a fun game room making the concept very family oriented and kid friendly."
Tim,Ford,tim.ford@choicehotels.com,,16087727344.0,Tim Ford,Owner & Portfolio Strategy Operations Director,http://www.linkedin.com/in/tim-ford,Choice Hotels International,http://www.choicehotels.com,restaurant_chains,1700,Owner & Portfolio Strategy Operations Director,owner,operations,Baltimore,Maryland,United States,http://www.linkedin.com/company/choice-hotels-international,6059,1939.0,choicehotels.com,+1 301-592-5000,,"915 Meeting St, North Bethesda, Maryland 20852, US",Maryland,Silver Spring,United States,,"lodging franchisor, hospitality, technology, hotels/resorts, consumer discretionary, hotel brands, hospitality industry, franchising, asset-light model, customer experience, loyalty program, digital innovation, upscale hotels, midscale hotels, extended stay, economy hotels, diverse portfolio, global presence, business travelers, family-friendly, customer demographics, technology integration, customer satisfaction, competitive pricing, community engagement, environmental sustainability, diverse workforce, strategic partnerships, market segments, travel rewards, hotel management systems, customer service, brand development, market awareness, experiential benefits, online booking, real-time reservations, hotel amenities, unique local experiences, budget-friendly accommodations, hotel acquisitions, franchise development, marketing strategy, customer reviews, operational excellence, leisure, travel & tourism, franchises, marketing & advertising, hotels, hotels & travel","Choice Hotels is a Maryland-based hospitality company that owns, operates and franchises 7,030 hotels around the world.",1553465000.0,1.6B,,,"ai, adobe marketing cloud, akamai, akamai dns, atlassian cloud, omniture (adobe), outlook, pardot, quickbooks, remote, soasta, salesforce, salesforce live agent, wp engine",Owner,Choice Hotels International,http://www.choicehotels.com,"Choice Hotels is a Maryland-based hospitality company that owns, operates and franchises 7,030 hotels around the world."
Philippe,Massoud,philippe@ililirestaurants.com,,19179451583.0,Philippe Massoud,"Owner, CEO, Executive Chef",http://www.linkedin.com/in/philippemassoud,Ilili Restaurants,http://www.ililirestaurants.com,restaurant_chains,63,"Founder And Owner Of Ilili Restaurant And Ilili Box. Evolving Lebanese And Levantine Cuisine, Culture And Hospitality...",owner,c_suite,New York,New York,United States,http://www.linkedin.com/company/ilili-restaurant,7100790,2007.0,ililirestaurants.com,+1 212-683-2929,28th St,"(between 27th and 28th St), New york, NY 10001, US",New York,New York,United States,11101,"lebanese mediterranean cuisine, traditional lebanese mediterranean mezza, grills, old world hospitality, catering, private events, weddings & corporate events, off site events, large groups, private dining, lebanese mediterranean food culture, lebanese cuisine, mediterranean food, event catering, drop-off catering, catering delivery, mezza, hummus, baba ghannouj, falafel, kibbeh, tabbouleh, grilled meats, shish taouk, lamb dishes, seafood, sweets, baklava, modern recipes, traditional ingredients, restaurant reservations, brunch, gift cards, corporate events, family gatherings, dining experience, casual dining, takeout food, fine dining, shared plates, event spaces, buffet options, seasonal menu, wine pairing, chefs specials, regional dishes, culinary traditions, cocktail receptions, wedding catering, lebanese hospitality, food delivery, menus, halal food, weekly specials, food & drink pairings, dinner parties, gourmet cuisine, catering packages, fine food service, cultural heritage, events services, restaurants, bars, cocktail bars, lebanese, mediterranean, middle eastern, nightlife","WELCOME TO ILILI.

We're honored to share the cuisine and culture of Lebanon in the heart of New York City and Washington DC. Since 2007, our home in the Flatiron District has introduced the passion and generosity of the Lebanese table to hundreds of thousands of curious diners while comforting native Lebanese guests with a celebration of their homeland and values.

Owner and Executive Chef Philippe Massoud expertly crafts a sophisticated blend
of modern and traditional Lebanese cuisine drawing influences from the span of the ancient Silk Road trade routes. Flavorful herbs and spices combine to delight the palate; earthy and delicate textures emerge from innovative combinations of savory and sweet; each bite reveals a deeper story behind the birth of the Eastern Mediterranean culinary culture.

Our warm and generous hospitality drives our mission to make every guest and team member feel genuinely welcomed and fundamentally honored. We are here to share; to pass fresh pita bread and mezze amongst old friends and new; to celebrate life and its delicious bounty.

We invite you to experience our old world hospitality, timeless generosity, and tireless dedication to uncovering and sharing the rich traditions of Lebanon and the Levant.",,,,,"7shifts, ai, audioeye, circle, emma, facebook custom audiences, facebook login (connect), facebook widget, google font api, google maps, google maps (non paid users), google tag manager, heapanalytics, microsoft office 365, mobile friendly, nginx, outlook, remote, stripe, typekit, varnish, zoominfo, recaptcha",Owner,ilili,http://www.ililirestaurants.com,"WELCOME TO ILILI.

We're honored to share the cuisine and culture of Lebanon in the heart of New York City and Washington DC. Since 2007, our home in the Flatiron District has introduced the passion and generosity of the Lebanese table to hundreds of thousands of curious diners while comforting native Lebanese guests with a celebration of their homeland and values.

Owner and Executive Chef Philippe Massoud expertly crafts a sophisticated blend
of modern and traditional Lebanese cuisine drawing influences from the span of the ancient Silk Road trade routes. Flavorful herbs and spices combine to delight the palate; earthy and delicate textures emerge from innovative combinations of savory and sweet; each bite reveals a deeper story behind the birth of the Eastern Mediterranean culinary culture.

Our warm and generous hospitality drives our mission to make every guest and team member feel genuinely welcomed and fundamentally honored. We are here to share; to pass fresh pita bread and mezze amongst old friends and new; to celebrate life and its delicious bounty.

We invite you to experience our old world hospitality, timeless generosity, and tireless dedication to uncovering and sharing the rich traditions of Lebanon and the Levant."
Jerome,Hranka,jerome@premiumloaves.com,,,Jerome Hranka,COO / Co-owner / Franchisee,http://www.linkedin.com/in/jerome-hranka-83315918,Premium Loaves Inc.,http://www.premiumloaves.com,restaurant_chains,28,"Jimmy John’s Franchisee In Il, Wi, Oh, Tx, Nc & Sc",owner,c_suite,Bloomington,Illinois,United States,http://www.linkedin.com/company/premium-loaves-inc,89949413,2018.0,premiumloaves.com,+1 309-454-2811,1717 Fort Jesse Rd,"1717 Ft. Jesse Rd., Suite 3, Normal, IL 61761, US",Illinois,Normal,United States,61761-2492,"sandwiches, locations, franchise, management, employee training, corporate partnerships, customer experience, business growth, promotions, healthy food, fun work environment, expansion strategy, local stores, quick service restaurant, leadership development, team culture, operational support, store performance, customer service, recruitment, sales growth, strategic planning, human resources, team building, financial management, marketing strategy, community engagement, food quality, product offerings, franchise opportunities, business operations, retail expansion, employee satisfaction, work-life balance, company mission, operational excellence, business ownership, executive leadership, franchise management, catering services, marketing initiatives, business acquisitions, store operations, people management, community outreach, healthy lifestyle, restaurant industry, food service, local business support, marketing & advertising",,,,,,"cloudflare hosting, cloudflare dns, google maps, google maps (non paid users), google tag manager, microsoft office 365, mobile friendly, outlook, remote",Owner,Premium Loaves,http://www.premiumloaves.com,
