first_name,last_name,email,personal_email,mobile_number,full_name,job_title,linkedin,company_name,company_website,industry,company_size,headline,seniority_level,functional_level,city,state,country,company_linkedin,company_linkedin_uid,company_founded_year,company_domain,company_phone,company_street_address,company_full_address,company_state,company_city,company_country,company_postal_code,keywords,company_description,company_annual_revenue,company_annual_revenue_clean,company_total_funding,company_total_funding_clean,company_technologies,title,organization_name,organization_website_url,organization_short_description
Jeffrey,Sieben,jeffrey.sieben@ptsem.edu,jeffrey.sieben@gmail.com,,Jeffrey Sieben,Avp & Chief Information Officer,http://www.linkedin.com/in/jeffreysieben,Princeton Theological Seminary,http://www.ptsem.edu,higher_education,380,"CIO & Avp | Strategic Technology Management And Implementation | Seasoned Team Builder | Cybersecurity, It Leadership",c_suite,c_suite,New York,New York,United States,http://www.linkedin.com/school/princeton-theological-seminary,70606,1812.0,ptsem.edu,+1 609-921-8300,64 Mercer St,"P.O. Box 821, 64 Mercer Street, Princeton, nj 08542-0803, US",New Jersey,Princeton,United States,08540,"theological education, presbyterian seminary, ministry, christian education, seminary, master of divinity degree, ma in christian education & formation, master of theology, phd, theology, religion, bible, ma, mdiv, macef, princeton theological seminary, phd program, masters degrees, online courses, hybrid offerings, community life, academic calendar, scholarships, financial aid, student support, faculty resources, wright library, theological research, christian leadership, curriculum development, field education, continuing education, spiritual formation, community engagement, religion & society, interdisciplinary study, pastoral care, homiletics, youth ministry, ecumenical dialogue, diversity in ministry, academic rigor, mph, justice initiatives, global services, macef program, sustainability education, accessibility resources, student testimonials, application process, mission & vision, graduate programs, intellectual inquiry, faith integration, leadership development, historical theology, certificates & credentials, programs of study, master of divinity, master of arts, doctor of philosophy, social justice, presbyterian church, diverse student body, research centers, theological library, leadership training, cultural proficiency, christian discernment, biblical interpretation, faith & intellect, racial & ethnic diversity, public theology, justice & public life, seminar series, faculty expertise, community building, environmental stewardship, professional development, lifelong learning, ministry preparation, academic excellence, collaborative learning, residential community, servant leadership, transformative education, theological scholarship, global church engagement, education management, professional training & coaching","Princeton Theological Seminary, a professional and graduate school of the Presbyterian Church (U.S.A.), stands within the Reformed tradition and exists to provide an excellent education to women and men who are called to ministry in the service of Jesus Christ. We are committed to shaping the next generation of pastors, chaplains, teachers, missionaries, professionals in the nonprofit or government sectors, and innovators of new forms of ministry. 

Princeton Theological Seminary cultivates rigorous scholarship and profound faith in an engaging community with an outstanding faculty, challenging curriculum, and hands-on field education program. A Princeton Seminary education inspires students to work boldly, dream big, and excel in the evolving world of ministry.",3749000.0,3.7M,,,"asp.net, amazon ses, atlassian confluence, bootstrap framework, certain software, circle, cloudflare hosting, cloudflare dns, crazyegg, doubleclick, doubleclick conversion, doubleclick floodlight, facebook conversion tracking, facebook custom audiences, facebook login (connect), facebook widget, formstack, gmail, google adsense, google analytics, google apps, google cloud hosting, google custom search, google dynamic remarketing, google font api, google tag manager, gravity forms, hotjar, jira, linkedin marketing solutions, mailchimp, mailchimp mandrill, microsoft office 365, microsoft-iis, mobile friendly, new relic, nginx, outlook, remote, salesforce, shutterstock, simpli.fi, statuspage io, varnish, vimeo, vuejs, wp engine, wordpress.org, youtube",Avp & Chief Information Officer,Princeton Theological Seminary,http://www.ptsem.edu,"Princeton Theological Seminary, a professional and graduate school of the Presbyterian Church (U.S.A.), stands within the Reformed tradition and exists to provide an excellent education to women and men who are called to ministry in the service of Jesus Christ. We are committed to shaping the next generation of pastors, chaplains, teachers, missionaries, professionals in the nonprofit or government sectors, and innovators of new forms of ministry. 

Princeton Theological Seminary cultivates rigorous scholarship and profound faith in an engaging community with an outstanding faculty, challenging curriculum, and hands-on field education program. A Princeton Seminary education inspires students to work boldly, dream big, and excel in the evolving world of ministry."
Sheri,Starkey,starkey@mail.smu.edu,,,Sheri Starkey,Associate Vice President And Chief Human Resource Officer ,http://www.linkedin.com/in/sheri-starkey-a76b1916,Smu,http://www.smu.edu,higher_education,39,Vice President And CHRO,c_suite,human_resources,Dallas,Texas,United States,http://www.linkedin.com/school/smudallas,5515,1911.0,smu.edu,+1 404-679-4500,6425 Boaz Ln,"6425 Boaz Lane, Dallas, Texas, USA, 75275",Texas,Dallas,United States,75205,"higher education, executive mba, continuing education, ceus, academic programs, graduate education, undergraduate admissions, research initiatives, financial assistance, scholarships, hands-on experience, study abroad, professional development, community engagement, interdisciplinary research, data science, high-performance computing, educational goals, student life, leadership development, career opportunities, international studies, arts & humanities, engineering programs, business education, law school, theology, public service, cultural engagement, alumni relations, impactful learning, entrepreneurial ecosystem, student resources, innovative teaching, experiential learning, campus facilities, education partnerships, scholarly research, student organizations, health & wellbeing, diversity & inclusion, community outreach, sports programs, academic excellence, global impact, technology transfer, knowledge creation, collaborative research, academic freedom, student support services, virtual learning, educational pathways, education management","A nationally ranked private university with seven degree-granting schools, SMU is a distinguished center for teaching and research located in the heart of Dallas. SMU's 11,000 students benefit from small classes, leadership opportunities, international study and innovative programs.",945000000.0,945M,,,"ab tasty, asp.net, active campaign, adobe media optimizer, amadesa, amazon aws, amazon ses, appnexus, atlassian cloud, atlassian confluence, bing ads, blackbaud, bootstrap framework, callrail, cedexis radar, constant contact, crazyegg, criteo, datadog, disqus, docusign, doubleclick, doubleclick conversion, doubleclick floodlight, drupal, dynect, emma, ensighten, facebook custom audiences, facebook login (connect), facebook widget, github hosting, google adsense, google adwords conversion, google analytics, google analytics ecommerce tracking, google custom search, google dynamic remarketing, google font api, google maps, google maps (non paid users), google play, google tag manager, google translate api, google translate widget, heapanalytics, highcharts js library, hotjar, hubspot, ibm websphere, indeed, intercom, jira, kaltura, linkedin login, linkedin marketing solutions, linkedin widget, livechat, marketo, microsoft-iis, mobile friendly, mouseflow, multilingual, onetrust, optimizely, outlook, panopto, pardot, pingdom, react redux, remote, ruby on rails, salesforce, salesforce live agent, segment.io, sharethis, signal by brighttag, signalr, sitescout, sizmek (mediamind), sparkpost, stripe, synxis (sabre hospitality), taleo, the trade desk, trustpilot, twitter advertising, typekit, userlike, vimeo, visual website optimizer, wistia, wordpress.org, wordpress vip, yahoo ad manager plus, yahoo analytics, youtube, itunes, recaptcha",Associate Vice President And Chief Human Resource Officer ,Smu,http://www.smu.edu,"A nationally ranked private university with seven degree-granting schools, SMU is a distinguished center for teaching and research located in the heart of Dallas. SMU's 11,000 students benefit from small classes, leadership opportunities, international study and innovative programs."
Patricia,Clay,pclay@hccc.edu,,16105548129.0,Patricia Clay,Associate Vice President CIO,http://www.linkedin.com/in/pmclay,Hudson County Community College,http://www.hccc.edu,higher_education,1200,Higher Education Technology Leader (she/her),c_suite,c_suite,Jersey City,New Jersey,United States,http://www.linkedin.com/school/hudson-county-community-college,44384,1974.0,hccc.edu,+1 201-714-7100,70 Sip Avenue,70 Sip Avenue,New Jersey,Jersey City,United States,07306,"higher education, nursing, culinary arts, center for business & industry, community college, hudson county, student success, workforce development, financial aid, scholarships, academic pathways, transfer pathways, online learning, continuing education, academic support, diversity equity inclusion, cultural affairs, veterans services, international student services, student life, tutoring services, certificate programs, nursing programs, stem education, scholarship opportunities, tutoring & mentorship, student resources, career services, partnerships, entrepreneurship programs, holistic student support, student organizations, community engagement, adult education, early college pathways, learning resources, mental health support, wellness center, advisement services, student orientation, emergency financial aid, food security programs, accessibility services, academic accreditation, innovative teaching, hands-on learning, apprenticeships, career counseling, job placement services, community involvement, federal student aid, student leadership, diverse student body, degree programs, academic excellence, inclusivity, affordable education, career development, workforce training, stem, health sciences, business administration, pell grants, non-traditional students, vocational training, advanced manufacturing, healthcare training, technology programs, environmental studies, entrepreneurship, holistic support, diversity & equity, jersey city, education management, e-learning, internet, information technology & services, computer software, education","Hudson County Community College was  established  in 1974  when  the  New Jersey Board  of  Higher  Education  approved  the  establishment  of  a community  college  commission  in  Hudson  County,  the  first  of
its  kind  in  the  country.  The  College  began  as  a  ""contract""  college. As one of only two such colleges in the United States, and the  sole  contract  college  in  New  Jersey,  its  goal  was  to  offer programs to students  that  reflected  the  nature  of  the  job  market.  Hudson  County  Community  College  received  its official name  in  1981.
    In  the  past  several  years,  Hudson  County  Community  College has  realized  unprecedented  growth,  with  enrollment  and graduation  rates  increasing  significantly  each  year.  Enrollment has  risen  from  4,129  students  in  1996  to  9,400  in  Fall  2011.This  growth  is  a  result  of  careful  and  thoughtful   planning  to (1)  enlarge  the  depth  and  number  of  course/class  offerings (including  scheduling  ""sunrise,""  weekend,  and  online  classes), (2)  enhance  students'  experiences  (including  the  establishment of a central counseling prog ram, and reorganized student activities  and  student  government  prog rams),  and  (3)  expand the  number  and  quality  of  its  facilities  by  adding  more  than eight  state-of-the-art  buildings  to  the  College's  campuses.",4588000.0,4.6M,,,"amazon aws, bootstrap framework, dns made easy, doubleclick, doubleclick conversion, eventbrite, facebook login (connect), facebook widget, google analytics, google dynamic remarketing, google font api, google tag manager, microsoft office 365, mimecast, mobile friendly, multilingual, outlook, twitter advertising, recaptcha",Associate Vice President CIO,Hudson County Community College,http://www.hccc.edu,"Hudson County Community College was  established  in 1974  when  the  New Jersey Board  of  Higher  Education  approved  the  establishment  of  a community  college  commission  in  Hudson  County,  the  first  of
its  kind  in  the  country.  The  College  began  as  a  ""contract""  college. As one of only two such colleges in the United States, and the  sole  contract  college  in  New  Jersey,  its  goal  was  to  offer programs to students  that  reflected  the  nature  of  the  job  market.  Hudson  County  Community  College  received  its official name  in  1981.
    In  the  past  several  years,  Hudson  County  Community  College has  realized  unprecedented  growth,  with  enrollment  and graduation  rates  increasing  significantly  each  year.  Enrollment has  risen  from  4,129  students  in  1996  to  9,400  in  Fall  2011.This  growth  is  a  result  of  careful  and  thoughtful   planning  to (1)  enlarge  the  depth  and  number  of  course/class  offerings (including  scheduling  ""sunrise,""  weekend,  and  online  classes), (2)  enhance  students'  experiences  (including  the  establishment of a central counseling prog ram, and reorganized student activities  and  student  government  prog rams),  and  (3)  expand the  number  and  quality  of  its  facilities  by  adding  more  than eight  state-of-the-art  buildings  to  the  College's  campuses."
Cleo,Rucker,cleo.rucker@belmont.edu,,,Cleo Rucker,Associate Vice President And Chief Human Resources Officer ,http://www.linkedin.com/in/cleo-rucker-669bb9103,Belmont University,http://www.belmont.edu,higher_education,900,Associate Vice President And Chief Human Resources Officer At Belmont University.,c_suite,c_suite,,,United States,http://www.linkedin.com/school/belmont-university,17844,1890.0,belmont.edu,+1 615-460-6000,1900 Belmont Blvd,"1900 Belmont Blvd, Nashville, TN 37212-3757, US",Tennessee,Nashville,United States,37212,"christian education, private university, undergraduate programs, graduate programs, student life, nashville university, career outcomes, diversity & inclusion, community engagement, holistic wellness, music business, theology programs, entrepreneurship, health & wellbeing, student leadership, academic resources, college admissions, financial aid, campus safety, international students, adult learners, creative arts, ncaa athletics, scholarships, vocational training, mentorship programs, online learning, hybrid courses, spiritual life, cultural diversity, academic excellence, college tours, college rankings, service learning, student organizations, alumni success, public advocacy, teacher education, nursing programs, performing arts, residence life, campus events, sustainability initiatives, business administration, social sciences, arts & sciences, event planning, community service opportunities, leadership development, private christian university, nashville, diverse leaders, experiential learning, healthcare education, student-focused community, holistic education, innovative teaching, community service, partnerships, campus life, character development, faith-based education, media & entertainment, supply chain management, student demographics, tuition assistance, virtual health services, mental health support, beautiful campus, networking opportunities, cultural events, financial aid challenges, student support services, e-learning, internet, information technology & services, computer software, education, education management, events services, logistics & supply chain","Located two miles from downtown Nashville, Tennessee, Belmont University comprises nearly 9,000 students from every state and 33 countries. Nationally ranked and consistently recognized by U.S. News & World Report for innovation in higher education, the University offers more than 115 areas of undergraduate study, 41 master's programs and five doctoral degrees. With a focus on whole person formation and data-informed social innovation, Belmont is committed to forming diverse leaders of character equipped to solve the world's complex problems. For more information, visit www.belmont.edu.",400000000.0,400M,,,"adobe media optimizer, amazon aws, amazon ses, bootstrap framework, cornerstone on demand, doubleclick floodlight, drupal, emma, facebook custom audiences, facebook login (connect), facebook widget, google adsense, google analytics, google font api, google maps, google maps (non paid users), google plus, google tag manager, heapanalytics, linkedin marketing solutions, marketo, mobile friendly, multilingual, new relic, outlook, react redux, route 53, salesforce, sparkpost, stripe, the trade desk, typekit, vimeo, vuejs, wordpress.org, youtube, recaptcha",Associate Vice President And Chief Human Resources Officer ,Belmont University,http://www.belmont.edu,"Located two miles from downtown Nashville, Tennessee, Belmont University comprises nearly 9,000 students from every state and 33 countries. Nationally ranked and consistently recognized by U.S. News & World Report for innovation in higher education, the University offers more than 115 areas of undergraduate study, 41 master's programs and five doctoral degrees. With a focus on whole person formation and data-informed social innovation, Belmont is committed to forming diverse leaders of character equipped to solve the world's complex problems. For more information, visit www.belmont.edu."
Dev,Tailor,dev@pharmacytownrx.com,,19739311018.0,Dev Tailor,Owner/chief Operating Officer,http://www.linkedin.com/in/dev-tailor-82694080,Pharmacy Town,http://www.pharmacytownrx.com,healthcare,15,Owner/chief Operating Officer  At Pharmacy Town,owner,c_suite,Clifton,New Jersey,United States,http://www.linkedin.com/company/pharmacy-town,14814125,,pharmacytownrx.com,+1 732-493-5100,35 Ocean Ave,"1590 new jersey 35, ocean township, nj, united states",New Jersey,Manasquan,United States,08736-3219,"wellness & fitness services, health, wellness & fitness",,,,,,"ai, android, apache, bootstrap framework, callrail, circle, flutter, godaddy hosting, google analytics, google font api, google play, google tag manager, iot, mobile friendly, phoenix, react native, remote, reviews, shutterstock, typekit, woo commerce, wordpress.org, comscore, itunes, recaptcha",Owner,Pharmacy Town,http://www.pharmacytownrx.com,
Bethany,Lang,bethany.lang@yogasix.com,,,Bethany Lang,Chief Operating Officer And Co-owner,http://www.linkedin.com/in/bethanywilliams1,Yogasix,http://www.yogasix.com,healthcare,1400,Chief Operating Officer And Co-owner,owner,c_suite,St. Louis,Missouri,United States,http://www.linkedin.com/company/yoga-six,2524453,2011.0,yogasix.com,+1 928-882-2080,17877 Von Karman Ave,"17877 Von Karman Ave, Irvine, California, US",California,Irvine,United States,92614,"yoga, heated yoga, 200 hour yoga teacher training, beginner yoga, private yoga, vinyasa, yoga workshops, advanced yoga, health, fitness, wellness, deep stretch, meditation, technique, body benefits, alignment, engagement, wellness & fitness services, yoga classes, hot yoga, yoga teacher training, vinyasa flow, mind-body experience, strength building, flexibility, agility, balance, class types, y6 slow flow, y6 restore, y6 hot flow, y6 power, y6 sculpt & flow, yoga for all levels, beginner yoga classes, fitness community, commercial fitness franchise, yoga programs, full body workout, trx training, yoga sculpting, yoga with weights, breath work, movement science, yoga philosophy, franchise opportunities, corporate wellness programs, loyalty program, energizing yoga, empowering classes, warm yoga, high-energy workout, restorative yoga, recovery yoga, yoga events, membership rewards, personal growth, enhancing mobility, online teacher training, international franchise, yoga class booking, mindfulness in yoga, community engagement, fitness transformation, mobile app for fitness, health & wellness, boutique yoga, heated yoga classes, non-heated yoga classes, boot camp-style fitness, class formats, y6 101, y6 hot, accessibility, inclusivity, community-oriented, holistic benefits, stress relief, fitness enthusiasts, busy professionals, mind-body wellness, diverse demographics, franchise growth, health & wellness industry, customer experience, sensory yoga experience, positive environment, effective workouts, variety of classes, personal health, health care, hospital & health care, health, wellness & fitness, active life, boot camps, fitness & instruction","We believe that everyone deserves the mind-body experience of yoga. By connecting you to a practice that is energizing, empowering, and fun. We deliver life-enhancing benefits through our six core classes: Y6 101, Y6 Stretch, Y6 Slow Flow, Y6 Hot, Y6 Power, and Y6 Sculpt & Flow. 

Or as we say at YogaSix: Calm mind. Strong vibe. Sweat tribe. 

Yoga created boutique fitness as we know it. At YogaSix we are changing the way people think. Our yoga and fitness classes allow our members to define their own practice. We help members connect to themselves in a way that is energizing, empowering, and fun. With an established and loyal following, YogaSix is a modernized yoga brand that promote accessibility and is poised for nationwide adoption.",35000000.0,35M,,,"adroll, bigcommerce, bing ads, cloudflare, cloudflare hosting, cloudflare dns, disqus, doubleclick, doubleclick conversion, emma, facebook custom audiences, facebook login (connect), facebook widget, gmail, google adsense, google adwords conversion, google analytics, google apps, google dynamic remarketing, google font api, google play, google tag manager, hubspot, justuno, linkedin marketing solutions, microsoft office 365, mobile friendly, new relic, react, simpli.fi, stripe, taboola, the trade desk, vimeo, zendesk, recaptcha",Owner,Yogasix,http://www.yogasix.com,"We believe that everyone deserves the mind-body experience of yoga. By connecting you to a practice that is energizing, empowering, and fun. We deliver life-enhancing benefits through our six core classes: Y6 101, Y6 Stretch, Y6 Slow Flow, Y6 Hot, Y6 Power, and Y6 Sculpt & Flow. 

Or as we say at YogaSix: Calm mind. Strong vibe. Sweat tribe. 

Yoga created boutique fitness as we know it. At YogaSix we are changing the way people think. Our yoga and fitness classes allow our members to define their own practice. We help members connect to themselves in a way that is energizing, empowering, and fun. With an established and loyal following, YogaSix is a modernized yoga brand that promote accessibility and is poised for nationwide adoption."
Clayton,Morrison,clayton@luminarecovery.com,,,Clayton Morrison,Co-owner & Chief Operating Officer,http://www.linkedin.com/in/clayton-morrison-b86b40195,Lumina Recovery,http://www.luminarecovery.com,healthcare,14,Co-owner & COO At Lumina Recovery,owner,c_suite,Westlake Village,California,United States,http://www.linkedin.com/company/lumina-recovery,101695016,,luminarecovery.com,+1 877-716-7515,,1 follower,,,,,"hospitals & health care, hospital & health care","At Lumina Recovery, we stand as a beacon of hope in Los Angeles, dedicated to helping individuals overcome addiction with compassion, innovation, and excellence. Our holistic approach, tailored to your unique needs, ensures a comprehensive path to sustainable recovery.",,,,,"gmail, google apps, google font api, google tag manager, gravity forms, mobile friendly, wordpress.org, recaptcha",Owner,Lumina Recovery,http://www.luminarecovery.com,"At Lumina Recovery, we stand as a beacon of hope in Los Angeles, dedicated to helping individuals overcome addiction with compassion, innovation, and excellence. Our holistic approach, tailored to your unique needs, ensures a comprehensive path to sustainable recovery."
